04:53:44.400200 IP ip-172-31-95-249.ec2.internal.ssh > ec2-35-172-155-194.compute-1.amazonaws.com.20657: Flags [P.], seq 334945878:334946090, ack 843151511, win 2518, options [nop,nop,TS val 48635770 ecr 4078881408], length 212
04:53:44.401095 IP ec2-35-172-155-194.compute-1.amazonaws.com.20657 > ip-172-31-95-249.ec2.internal.ssh: Flags [.], ack 212, win 4138, options [nop,nop,TS val 4078881468 ecr 48635770], length 0
04:53:44.545482 IP ec2-35-172-155-194.compute-1.amazonaws.com.20657 > ip-172-31-95-249.ec2.internal.ssh: Flags [P.], seq 1:117, ack 212, win 4139, options [nop,nop,TS val 4078881611 ecr 48635770], length 116
04:53:44.550309 IP ip-172-31-95-249.ec2.internal.ssh > ec2-35-172-155-194.compute-1.amazonaws.com.20657: Flags [P.], seq 212:256, ack 117, win 2518, options [nop,nop,TS val 48635920 ecr 4078881611], length 44
04:53:44.550360 IP ip-172-31-95-249.ec2.internal.ssh > ec2-35-172-155-194.compute-1.amazonaws.com.20657: Flags [P.], seq 256:300, ack 117, win 2518, options [nop,nop,TS val 48635920 ecr 4078881611], length 44
04:53:44.551216 IP ec2-35-172-155-194.compute-1.amazonaws.com.20657 > ip-172-31-95-249.ec2.internal.ssh: Flags [.], ack 256, win 4139, options [nop,nop,TS val 4078881619 ecr 48635920], length 0
04:53:44.551226 IP ec2-35-172-155-194.compute-1.amazonaws.com.20657 > ip-172-31-95-249.ec2.internal.ssh: Flags [.], ack 300, win 4139, options [nop,nop,TS val 4078881619 ecr 48635920], length 0
04:53:44.694083 IP ip-172-31-95-249.ec2.internal.ssh > ec2-35-172-155-194.compute-1.amazonaws.com.20657: Flags [P.], seq 300:344, ack 117, win 2518, options [nop,nop,TS val 48636064 ecr 4078881619], length 44
04:53:44.694166 IP ip-172-31-95-249.ec2.internal.ssh > ec2-35-172-155-194.compute-1.amazonaws.com.20657: Flags [P.], seq 344:1388, ack 117, win 2518, options [nop,nop,TS val 48636064 ecr 4078881619], length 1044
04:53:44.694956 IP ec2-35-172-155-194.compute-1.amazonaws.com.20657 > ip-172-31-95-249.ec2.internal.ssh: Flags [.], ack 344, win 4139, options [nop,nop,TS val 4078881762 ecr 48636064], length 0
04:53:44.695017 IP ec2-35-172-155-194.compute-1.amazonaws.com.20657 > ip-172-31-95-249.ec2.internal.ssh: Flags [.], ack 1388, win 4131, options [nop,nop,TS val 4078881762 ecr 48636064], length 0
04:53:45.003859 IP ec2-35-172-155-194.compute-1.amazonaws.com.20657 > ip-172-31-95-249.ec2.internal.ssh: Flags [P.], seq 117:217, ack 1388, win 4139, options [nop,nop,TS val 4078882071 ecr 48636064], length 100
04:53:45.004980 IP ip-172-31-95-249.ec2.internal.ssh > ec2-35-172-155-194.compute-1.amazonaws.com.20657: Flags [P.], seq 1388:1432, ack 217, win 2518, options [nop,nop,TS val 48636375 ecr 4078882071], length 44
04:53:45.005120 IP ip-172-31-95-249.ec2.internal.ssh > ec2-35-172-155-194.compute-1.amazonaws.com.20657: Flags [P.], seq 1432:1692, ack 217, win 2518, options [nop,nop,TS val 48636375 ecr 4078882071], length 260
04:53:45.005961 IP ec2-35-172-155-194.compute-1.amazonaws.com.20657 > ip-172-31-95-249.ec2.internal.ssh: Flags [.], ack 1432, win 4139, options [nop,nop,TS val 4078882073 ecr 48636375], length 0
04:53:45.005997 IP ec2-35-172-155-194.compute-1.amazonaws.com.20657 > ip-172-31-95-249.ec2.internal.ssh: Flags [.], ack 1692, win 4137, options [nop,nop,TS val 4078882073 ecr 48636375], length 0
04:53:45.382964 IP ip-172-31-95-249.ec2.internal.34300 > ip-172-31-0-2.ec2.internal.domain: 25231+ PTR? 194.155.172.35.in-addr.arpa. (45)
04:53:45.383299 IP ip-172-31-0-2.ec2.internal.domain > ip-172-31-95-249.ec2.internal.34300: 25231 1/0/0 PTR ec2-35-172-155-194.compute-1.amazonaws.com. (101)
04:53:45.383412 IP ip-172-31-95-249.ec2.internal.57188 > ip-172-31-0-2.ec2.internal.domain: 4612+ PTR? 249.95.31.172.in-addr.arpa. (44)
04:53:45.383626 IP ip-172-31-0-2.ec2.internal.domain > ip-172-31-95-249.ec2.internal.57188: 4612 1/0/0 PTR ip-172-31-95-249.ec2.internal. (87)
04:53:45.398875 IP ec2-35-172-155-194.compute-1.amazonaws.com.20657 > ip-172-31-95-249.ec2.internal.ssh: Flags [P.], seq 217:413, ack 1692, win 4139, options [nop,nop,TS val 4078882466 ecr 48636375], length 196
04:53:45.399354 IP ip-172-31-95-249.ec2.internal.ssh > ec2-35-172-155-194.compute-1.amazonaws.com.20657: Flags [P.], seq 1692:1808, ack 413, win 2518, options [nop,nop,TS val 48636769 ecr 4078882466], length 116
04:53:45.399743 IP ip-172-31-95-249.ec2.internal.ssh > ec2-35-172-155-194.compute-1.amazonaws.com.20657: Flags [P.], seq 1808:1852, ack 413, win 2518, options [nop,nop,TS val 48636769 ecr 4078882466], length 44
04:53:45.399759 IP ip-172-31-95-249.ec2.internal.ssh > ec2-35-172-155-194.compute-1.amazonaws.com.20657: Flags [P.], seq 1852:1960, ack 413, win 2518, options [nop,nop,TS val 48636769 ecr 4078882466], length 108
04:53:45.400216 IP ec2-35-172-155-194.compute-1.amazonaws.com.20657 > ip-172-31-95-249.ec2.internal.ssh: Flags [.], ack 1808, win 4139, options [nop,nop,TS val 4078882468 ecr 48636769], length 0
04:53:45.400598 IP ec2-35-172-155-194.compute-1.amazonaws.com.20657 > ip-172-31-95-249.ec2.internal.ssh: Flags [.], ack 1852, win 4139, options [nop,nop,TS val 4078882468 ecr 48636769], length 0
04:53:45.400601 IP ec2-35-172-155-194.compute-1.amazonaws.com.20657 > ip-172-31-95-249.ec2.internal.ssh: Flags [.], ack 1960, win 4139, options [nop,nop,TS val 4078882468 ecr 48636769], length 0
04:53:45.659101 IP ec2-35-172-155-194.compute-1.amazonaws.com.20657 > ip-172-31-95-249.ec2.internal.ssh: Flags [P.], seq 413:569, ack 1960, win 4139, options [nop,nop,TS val 4078882726 ecr 48636769], length 156
04:53:45.659723 IP ip-172-31-95-249.ec2.internal.ssh > ec2-35-172-155-194.compute-1.amazonaws.com.20657: Flags [P.], seq 1960:2004, ack 569, win 2518, options [nop,nop,TS val 48637029 ecr 4078882726], length 44
04:53:45.659759 IP ip-172-31-95-249.ec2.internal.ssh > ec2-35-172-155-194.compute-1.amazonaws.com.20657: Flags [P.], seq 2004:2368, ack 569, win 2518, options [nop,nop,TS val 48637029 ecr 4078882726], length 364
04:53:45.660585 IP ec2-35-172-155-194.compute-1.amazonaws.com.20657 > ip-172-31-95-249.ec2.internal.ssh: Flags [.], ack 2004, win 4139, options [nop,nop,TS val 4078882728 ecr 48637029], length 0
04:53:45.660592 IP ec2-35-172-155-194.compute-1.amazonaws.com.20657 > ip-172-31-95-249.ec2.internal.ssh: Flags [.], ack 2368, win 4137, options [nop,nop,TS val 4078882728 ecr 48637029], length 0
04:53:45.893176 IP ec2-35-172-155-194.compute-1.amazonaws.com.20657 > ip-172-31-95-249.ec2.internal.ssh: Flags [P.], seq 569:725, ack 2368, win 4139, options [nop,nop,TS val 4078882960 ecr 48637029], length 156
04:53:45.896998 IP ip-172-31-95-249.ec2.internal.ssh > ec2-35-172-155-194.compute-1.amazonaws.com.20657: Flags [P.], seq 2368:2412, ack 725, win 2518, options [nop,nop,TS val 48637267 ecr 4078882960], length 44
04:53:45.897064 IP ip-172-31-95-249.ec2.internal.ssh > ec2-35-172-155-194.compute-1.amazonaws.com.20657: Flags [P.], seq 2412:2776, ack 725, win 2518, options [nop,nop,TS val 48637267 ecr 4078882960], length 364
04:53:45.897868 IP ec2-35-172-155-194.compute-1.amazonaws.com.20657 > ip-172-31-95-249.ec2.internal.ssh: Flags [.], ack 2412, win 4139, options [nop,nop,TS val 4078882965 ecr 48637267], length 0
04:53:45.897881 IP ec2-35-172-155-194.compute-1.amazonaws.com.20657 > ip-172-31-95-249.ec2.internal.ssh: Flags [.], ack 2776, win 4137, options [nop,nop,TS val 4078882965 ecr 48637267], length 0
04:53:46.140892 IP ec2-35-172-155-194.compute-1.amazonaws.com.20657 > ip-172-31-95-249.ec2.internal.ssh: Flags [P.], seq 725:905, ack 2776, win 4139, options [nop,nop,TS val 4078883208 ecr 48637267], length 180
04:53:46.142693 IP ip-172-31-95-249.ec2.internal.ssh > ec2-35-172-155-194.compute-1.amazonaws.com.20657: Flags [P.], seq 2776:2876, ack 905, win 2518, options [nop,nop,TS val 48637512 ecr 4078883208], length 100
04:53:46.142955 IP ip-172-31-95-249.ec2.internal.ssh > ec2-35-172-155-194.compute-1.amazonaws.com.20657: Flags [P.], seq 2876:2920, ack 905, win 2518, options [nop,nop,TS val 48637513 ecr 4078883208], length 44
04:53:46.142971 IP ip-172-31-95-249.ec2.internal.ssh > ec2-35-172-155-194.compute-1.amazonaws.com.20657: Flags [P.], seq 2920:3028, ack 905, win 2518, options [nop,nop,TS val 48637513 ecr 4078883208], length 108
04:53:46.143595 IP ec2-35-172-155-194.compute-1.amazonaws.com.20657 > ip-172-31-95-249.ec2.internal.ssh: Flags [.], ack 2876, win 4139, options [nop,nop,TS val 4078883211 ecr 48637512], length 0
04:53:46.143809 IP ec2-35-172-155-194.compute-1.amazonaws.com.20657 > ip-172-31-95-249.ec2.internal.ssh: Flags [.], ack 2920, win 4139, options [nop,nop,TS val 4078883211 ecr 48637513], length 0
04:53:46.143816 IP ec2-35-172-155-194.compute-1.amazonaws.com.20657 > ip-172-31-95-249.ec2.internal.ssh: Flags [.], ack 3028, win 4139, options [nop,nop,TS val 4078883211 ecr 48637513], length 0
04:53:46.406718 IP ip-172-31-95-249.ec2.internal.55606 > ip-172-31-0-2.ec2.internal.domain: 8953+ PTR? 2.0.31.172.in-addr.arpa. (41)
04:53:46.407108 IP ip-172-31-0-2.ec2.internal.domain > ip-172-31-95-249.ec2.internal.55606: 8953 1/0/0 PTR ip-172-31-0-2.ec2.internal. (81)
04:53:46.410571 IP ec2-35-172-155-194.compute-1.amazonaws.com.20657 > ip-172-31-95-249.ec2.internal.ssh: Flags [P.], seq 905:1061, ack 3028, win 4139, options [nop,nop,TS val 4078883478 ecr 48637513], length 156
04:53:46.411571 IP ip-172-31-95-249.ec2.internal.ssh > ec2-35-172-155-194.compute-1.amazonaws.com.20657: Flags [P.], seq 3028:3072, ack 1061, win 2518, options [nop,nop,TS val 48637781 ecr 4078883478], length 44
04:53:46.411636 IP ip-172-31-95-249.ec2.internal.ssh > ec2-35-172-155-194.compute-1.amazonaws.com.20657: Flags [P.], seq 3072:3436, ack 1061, win 2518, options [nop,nop,TS val 48637781 ecr 4078883478], length 364
04:53:46.412441 IP ec2-35-172-155-194.compute-1.amazonaws.com.20657 > ip-172-31-95-249.ec2.internal.ssh: Flags [.], ack 3072, win 4139, options [nop,nop,TS val 4078883480 ecr 48637781], length 0
04:53:46.412471 IP ec2-35-172-155-194.compute-1.amazonaws.com.20657 > ip-172-31-95-249.ec2.internal.ssh: Flags [.], ack 3436, win 4137, options [nop,nop,TS val 4078883480 ecr 48637781], length 0
04:53:46.425247 IP ec2-35-172-155-194.compute-1.amazonaws.com.20657 > ip-172-31-95-249.ec2.internal.ssh: Flags [P.], seq 1061:1105, ack 3436, win 4139, options [nop,nop,TS val 4078883492 ecr 48637781], length 44
04:53:46.425257 IP ec2-35-172-155-194.compute-1.amazonaws.com.20657 > ip-172-31-95-249.ec2.internal.ssh: Flags [P.], seq 1105:1197, ack 3436, win 4139, options [nop,nop,TS val 4078883492 ecr 48637781], length 92
04:53:46.425285 IP ip-172-31-95-249.ec2.internal.ssh > ec2-35-172-155-194.compute-1.amazonaws.com.20657: Flags [.], ack 1197, win 2518, options [nop,nop,TS val 48637795 ecr 4078883492], length 0
04:53:46.425621 IP ip-172-31-95-249.ec2.internal.ssh > ec2-35-172-155-194.compute-1.amazonaws.com.20657: Flags [P.], seq 3436:3480, ack 1197, win 2518, options [nop,nop,TS val 48637795 ecr 4078883492], length 44
04:53:46.425653 IP ip-172-31-95-249.ec2.internal.ssh > ec2-35-172-155-194.compute-1.amazonaws.com.20657: Flags [P.], seq 3480:3740, ack 1197, win 2518, options [nop,nop,TS val 48637795 ecr 4078883492], length 260
04:53:46.426501 IP ec2-35-172-155-194.compute-1.amazonaws.com.20657 > ip-172-31-95-249.ec2.internal.ssh: Flags [.], ack 3740, win 4139, options [nop,nop,TS val 4078883494 ecr 48637795], length 0
04:53:46.668484 IP ec2-35-172-155-194.compute-1.amazonaws.com.20657 > ip-172-31-95-249.ec2.internal.ssh: Flags [P.], seq 1197:1353, ack 3740, win 4139, options [nop,nop,TS val 4078883736 ecr 48637795], length 156
04:53:46.669077 IP ip-172-31-95-249.ec2.internal.ssh > ec2-35-172-155-194.compute-1.amazonaws.com.20657: Flags [P.], seq 3740:3784, ack 1353, win 2518, options [nop,nop,TS val 48638039 ecr 4078883736], length 44
04:53:46.669142 IP ip-172-31-95-249.ec2.internal.ssh > ec2-35-172-155-194.compute-1.amazonaws.com.20657: Flags [P.], seq 3784:4148, ack 1353, win 2518, options [nop,nop,TS val 48638039 ecr 4078883736], length 364
04:53:46.670051 IP ec2-35-172-155-194.compute-1.amazonaws.com.20657 > ip-172-31-95-249.ec2.internal.ssh: Flags [.], ack 4148, win 4139, options [nop,nop,TS val 4078883737 ecr 48638039], length 0
04:53:46.758662 IP ip-172-31-95-249.ec2.internal.ssh > ec2-35-172-155-194.compute-1.amazonaws.com.20657: Flags [P.], seq 4148:5200, ack 1353, win 2518, options [nop,nop,TS val 48638128 ecr 4078883737], length 1052
04:53:46.801549 IP ec2-35-172-155-194.compute-1.amazonaws.com.20657 > ip-172-31-95-249.ec2.internal.ssh: Flags [.], ack 5200, win 4139, options [nop,nop,TS val 4078883869 ecr 48638128], length 0
04:53:46.924106 IP ec2-35-172-155-194.compute-1.amazonaws.com.20657 > ip-172-31-95-249.ec2.internal.ssh: Flags [P.], seq 1353:1437, ack 5200, win 4139, options [nop,nop,TS val 4078883991 ecr 48638128], length 84
04:53:46.924520 IP ip-172-31-95-249.ec2.internal.ssh > ec2-35-172-155-194.compute-1.amazonaws.com.20657: Flags [P.], seq 5200:5268, ack 1437, win 2518, options [nop,nop,TS val 48638294 ecr 4078883991], length 68
04:53:46.925391 IP ec2-35-172-155-194.compute-1.amazonaws.com.20657 > ip-172-31-95-249.ec2.internal.ssh: Flags [.], ack 5268, win 4139, options [nop,nop,TS val 4078883993 ecr 48638294], length 0
04:53:47.005743 IP ec2-35-172-155-194.compute-1.amazonaws.com.20657 > ip-172-31-95-249.ec2.internal.ssh: Flags [P.], seq 1437:1633, ack 5268, win 4139, options [nop,nop,TS val 4078884073 ecr 48638294], length 196
04:53:47.006102 IP ip-172-31-95-249.ec2.internal.ssh > ec2-35-172-155-194.compute-1.amazonaws.com.20657: Flags [P.], seq 5268:5384, ack 1633, win 2518, options [nop,nop,TS val 48638376 ecr 4078884073], length 116
04:53:47.006380 IP ip-172-31-95-249.ec2.internal.ssh > ec2-35-172-155-194.compute-1.amazonaws.com.20657: Flags [P.], seq 5384:5500, ack 1633, win 2518, options [nop,nop,TS val 48638376 ecr 4078884073], length 116
04:53:47.006986 IP ec2-35-172-155-194.compute-1.amazonaws.com.20657 > ip-172-31-95-249.ec2.internal.ssh: Flags [.], ack 5384, win 4139, options [nop,nop,TS val 4078884074 ecr 48638376], length 0
04:53:47.007233 IP ec2-35-172-155-194.compute-1.amazonaws.com.20657 > ip-172-31-95-249.ec2.internal.ssh: Flags [.], ack 5500, win 4139, options [nop,nop,TS val 4078884075 ecr 48638376], length 0
04:53:47.271739 IP ec2-35-172-155-194.compute-1.amazonaws.com.20657 > ip-172-31-95-249.ec2.internal.ssh: Flags [P.], seq 1633:1789, ack 5500, win 4139, options [nop,nop,TS val 4078884339 ecr 48638376], length 156
04:53:47.272351 IP ip-172-31-95-249.ec2.internal.ssh > ec2-35-172-155-194.compute-1.amazonaws.com.20657: Flags [P.], seq 5500:5872, ack 1789, win 2518, options [nop,nop,TS val 48638642 ecr 4078884339], length 372
04:53:47.273251 IP ec2-35-172-155-194.compute-1.amazonaws.com.20657 > ip-172-31-95-249.ec2.internal.ssh: Flags [.], ack 5872, win 4137, options [nop,nop,TS val 4078884341 ecr 48638642], length 0
04:53:47.508175 IP ec2-35-172-155-194.compute-1.amazonaws.com.20657 > ip-172-31-95-249.ec2.internal.ssh: Flags [P.], seq 1789:1945, ack 5872, win 4139, options [nop,nop,TS val 4078884575 ecr 48638642], length 156
04:53:47.508847 IP ip-172-31-95-249.ec2.internal.ssh > ec2-35-172-155-194.compute-1.amazonaws.com.20657: Flags [P.], seq 5872:5916, ack 1945, win 2518, options [nop,nop,TS val 48638878 ecr 4078884575], length 44
04:53:47.508918 IP ip-172-31-95-249.ec2.internal.ssh > ec2-35-172-155-194.compute-1.amazonaws.com.20657: Flags [P.], seq 5916:6280, ack 1945, win 2518, options [nop,nop,TS val 48638879 ecr 4078884575], length 364
04:53:47.509752 IP ec2-35-172-155-194.compute-1.amazonaws.com.20657 > ip-172-31-95-249.ec2.internal.ssh: Flags [.], ack 5916, win 4139, options [nop,nop,TS val 4078884577 ecr 48638878], length 0
04:53:47.509758 IP ec2-35-172-155-194.compute-1.amazonaws.com.20657 > ip-172-31-95-249.ec2.internal.ssh: Flags [.], ack 6280, win 4137, options [nop,nop,TS val 4078884577 ecr 48638879], length 0
04:53:47.712218 IP ec2-35-172-155-194.compute-1.amazonaws.com.20657 > ip-172-31-95-249.ec2.internal.ssh: Flags [P.], seq 1945:2093, ack 6280, win 4139, options [nop,nop,TS val 4078884779 ecr 48638879], length 148
04:53:47.712692 IP ip-172-31-95-249.ec2.internal.ssh > ec2-35-172-155-194.compute-1.amazonaws.com.20657: Flags [P.], seq 6280:6324, ack 2093, win 2518, options [nop,nop,TS val 48639082 ecr 4078884779], length 44
04:53:47.712776 IP ip-172-31-95-249.ec2.internal.ssh > ec2-35-172-155-194.compute-1.amazonaws.com.20657: Flags [P.], seq 6324:6384, ack 2093, win 2518, options [nop,nop,TS val 48639082 ecr 4078884779], length 60
04:53:47.713595 IP ec2-35-172-155-194.compute-1.amazonaws.com.20657 > ip-172-31-95-249.ec2.internal.ssh: Flags [.], ack 6324, win 4139, options [nop,nop,TS val 4078884781 ecr 48639082], length 0
04:53:47.713615 IP ec2-35-172-155-194.compute-1.amazonaws.com.20657 > ip-172-31-95-249.ec2.internal.ssh: Flags [.], ack 6384, win 4139, options [nop,nop,TS val 4078884781 ecr 48639082], length 0
04:53:47.781929 IP ip-172-31-95-249.ec2.internal.ssh > ec2-35-172-155-194.compute-1.amazonaws.com.20657: Flags [P.], seq 6384:7436, ack 2093, win 2518, options [nop,nop,TS val 48639152 ecr 4078884781], length 1052
04:53:47.782846 IP ec2-35-172-155-194.compute-1.amazonaws.com.20657 > ip-172-31-95-249.ec2.internal.ssh: Flags [.], ack 7436, win 4131, options [nop,nop,TS val 4078884850 ecr 48639152], length 0
04:53:47.859261 IP ec2-35-172-155-194.compute-1.amazonaws.com.20657 > ip-172-31-95-249.ec2.internal.ssh: Flags [P.], seq 2093:2233, ack 7436, win 4139, options [nop,nop,TS val 4078884927 ecr 48639152], length 140
04:53:47.859380 IP ec2-35-172-155-194.compute-1.amazonaws.com.20657 > ip-172-31-95-249.ec2.internal.ssh: Flags [P.], seq 2233:2413, ack 7436, win 4139, options [nop,nop,TS val 4078884927 ecr 48639152], length 180
04:53:47.859421 IP ip-172-31-95-249.ec2.internal.ssh > ec2-35-172-155-194.compute-1.amazonaws.com.20657: Flags [.], ack 2413, win 2518, options [nop,nop,TS val 48639229 ecr 4078884927], length 0
04:53:47.859571 IP ip-172-31-95-249.ec2.internal.ssh > ec2-35-172-155-194.compute-1.amazonaws.com.20657: Flags [P.], seq 7436:7552, ack 2413, win 2518, options [nop,nop,TS val 48639229 ecr 4078884927], length 116
04:53:47.859607 IP ec2-35-172-155-194.compute-1.amazonaws.com.20657 > ip-172-31-95-249.ec2.internal.ssh: Flags [P.], seq 2413:2513, ack 7436, win 4139, options [nop,nop,TS val 4078884927 ecr 48639152], length 100
04:53:47.860178 IP ip-172-31-95-249.ec2.internal.ssh > ec2-35-172-155-194.compute-1.amazonaws.com.20657: Flags [P.], seq 7552:7596, ack 2513, win 2518, options [nop,nop,TS val 48639230 ecr 4078884927], length 44
04:53:47.860235 IP ip-172-31-95-249.ec2.internal.ssh > ec2-35-172-155-194.compute-1.amazonaws.com.20657: Flags [P.], seq 7596:7640, ack 2513, win 2518, options [nop,nop,TS val 48639230 ecr 4078884927], length 44
04:53:47.860409 IP ec2-35-172-155-194.compute-1.amazonaws.com.20657 > ip-172-31-95-249.ec2.internal.ssh: Flags [.], ack 7552, win 4139, options [nop,nop,TS val 4078884928 ecr 48639229], length 0
04:53:47.861040 IP ec2-35-172-155-194.compute-1.amazonaws.com.20657 > ip-172-31-95-249.ec2.internal.ssh: Flags [.], ack 7596, win 4139, options [nop,nop,TS val 4078884928 ecr 48639230], length 0
04:53:47.861059 IP ec2-35-172-155-194.compute-1.amazonaws.com.20657 > ip-172-31-95-249.ec2.internal.ssh: Flags [.], ack 7640, win 4139, options [nop,nop,TS val 4078884928 ecr 48639230], length 0
04:53:47.862014 IP ip-172-31-95-249.ec2.internal.ssh > ec2-35-172-155-194.compute-1.amazonaws.com.20657: Flags [P.], seq 7640:7796, ack 2513, win 2518, options [nop,nop,TS val 48639232 ecr 4078884928], length 156
04:53:47.862862 IP ec2-35-172-155-194.compute-1.amazonaws.com.20657 > ip-172-31-95-249.ec2.internal.ssh: Flags [.], ack 7796, win 4139, options [nop,nop,TS val 4078884930 ecr 48639232], length 0
04:53:47.863426 IP ip-172-31-95-249.ec2.internal.ssh > ec2-35-172-155-194.compute-1.amazonaws.com.20657: Flags [P.], seq 7796:7840, ack 2513, win 2518, options [nop,nop,TS val 48639233 ecr 4078884930], length 44
04:53:47.863457 IP ip-172-31-95-249.ec2.internal.ssh > ec2-35-172-155-194.compute-1.amazonaws.com.20657: Flags [P.], seq 7840:8100, ack 2513, win 2518, options [nop,nop,TS val 48639233 ecr 4078884930], length 260
04:53:47.864313 IP ec2-35-172-155-194.compute-1.amazonaws.com.20657 > ip-172-31-95-249.ec2.internal.ssh: Flags [.], ack 7840, win 4139, options [nop,nop,TS val 4078884932 ecr 48639233], length 0
04:53:47.864321 IP ec2-35-172-155-194.compute-1.amazonaws.com.20657 > ip-172-31-95-249.ec2.internal.ssh: Flags [.], ack 8100, win 4137, options [nop,nop,TS val 4078884932 ecr 48639233], length 0
04:53:47.864960 IP ip-172-31-95-249.ec2.internal.ssh > ec2-35-172-155-194.compute-1.amazonaws.com.20657: Flags [P.], seq 8100:8248, ack 2513, win 2518, options [nop,nop,TS val 48639235 ecr 4078884932], length 148
04:53:47.865808 IP ec2-35-172-155-194.compute-1.amazonaws.com.20657 > ip-172-31-95-249.ec2.internal.ssh: Flags [.], ack 8248, win 4139, options [nop,nop,TS val 4078884933 ecr 48639235], length 0
04:53:47.865841 IP ip-172-31-95-249.ec2.internal.ssh > ec2-35-172-155-194.compute-1.amazonaws.com.20657: Flags [P.], seq 8248:8420, ack 2513, win 2518, options [nop,nop,TS val 48639235 ecr 4078884933], length 172
04:53:47.866712 IP ec2-35-172-155-194.compute-1.amazonaws.com.20657 > ip-172-31-95-249.ec2.internal.ssh: Flags [.], ack 8420, win 4139, options [nop,nop,TS val 4078884934 ecr 48639235], length 0
04:53:47.873964 IP ip-172-31-95-249.ec2.internal.ssh > ec2-35-172-155-194.compute-1.amazonaws.com.20657: Flags [P.], seq 8420:8576, ack 2513, win 2518, options [nop,nop,TS val 48639244 ecr 4078884934], length 156
04:53:47.874257 IP ip-172-31-95-249.ec2.internal.ssh > ec2-35-172-155-194.compute-1.amazonaws.com.20657: Flags [P.], seq 8576:8812, ack 2513, win 2518, options [nop,nop,TS val 48639244 ecr 4078884934], length 236
04:53:47.874558 IP ip-172-31-95-249.ec2.internal.ssh > ec2-35-172-155-194.compute-1.amazonaws.com.20657: Flags [P.], seq 8812:8960, ack 2513, win 2518, options [nop,nop,TS val 48639244 ecr 4078884934], length 148
04:53:47.874855 IP ec2-35-172-155-194.compute-1.amazonaws.com.20657 > ip-172-31-95-249.ec2.internal.ssh: Flags [.], ack 8576, win 4139, options [nop,nop,TS val 4078884942 ecr 48639244], length 0
04:53:47.874922 IP ip-172-31-95-249.ec2.internal.ssh > ec2-35-172-155-194.compute-1.amazonaws.com.20657: Flags [P.], seq 8960:9004, ack 2513, win 2518, options [nop,nop,TS val 48639245 ecr 4078884942], length 44
04:53:47.875000 IP ip-172-31-95-249.ec2.internal.ssh > ec2-35-172-155-194.compute-1.amazonaws.com.20657: Flags [.], seq 9004:16244, ack 2513, win 2518, options [nop,nop,TS val 48639245 ecr 4078884942], length 7240
04:53:47.875127 IP ec2-35-172-155-194.compute-1.amazonaws.com.20657 > ip-172-31-95-249.ec2.internal.ssh: Flags [.], ack 8812, win 4139, options [nop,nop,TS val 4078884942 ecr 48639244], length 0
04:53:47.875134 IP ip-172-31-95-249.ec2.internal.ssh > ec2-35-172-155-194.compute-1.amazonaws.com.20657: Flags [.], seq 16244:22036, ack 2513, win 2518, options [nop,nop,TS val 48639245 ecr 4078884942], length 5792
04:53:47.875448 IP ec2-35-172-155-194.compute-1.amazonaws.com.20657 > ip-172-31-95-249.ec2.internal.ssh: Flags [.], ack 8960, win 4139, options [nop,nop,TS val 4078884943 ecr 48639244], length 0
04:53:47.875452 IP ip-172-31-95-249.ec2.internal.ssh > ec2-35-172-155-194.compute-1.amazonaws.com.20657: Flags [P.], seq 22036:22324, ack 2513, win 2518, options [nop,nop,TS val 48639245 ecr 4078884943], length 288
04:53:47.875774 IP ec2-35-172-155-194.compute-1.amazonaws.com.20657 > ip-172-31-95-249.ec2.internal.ssh: Flags [.], ack 9004, win 4139, options [nop,nop,TS val 4078884943 ecr 48639245], length 0
04:53:47.875974 IP ec2-35-172-155-194.compute-1.amazonaws.com.20657 > ip-172-31-95-249.ec2.internal.ssh: Flags [.], ack 11900, win 4139, options [nop,nop,TS val 4078884943 ecr 48639245], length 0
04:53:47.875978 IP ec2-35-172-155-194.compute-1.amazonaws.com.20657 > ip-172-31-95-249.ec2.internal.ssh: Flags [.], ack 16244, win 4139, options [nop,nop,TS val 4078884943 ecr 48639245], length 0
04:53:47.876048 IP ec2-35-172-155-194.compute-1.amazonaws.com.20657 > ip-172-31-95-249.ec2.internal.ssh: Flags [.], ack 22036, win 4139, options [nop,nop,TS val 4078884943 ecr 48639245], length 0
04:53:47.876336 IP ec2-35-172-155-194.compute-1.amazonaws.com.20657 > ip-172-31-95-249.ec2.internal.ssh: Flags [.], ack 22324, win 4139, options [nop,nop,TS val 4078884944 ecr 48639245], length 0
04:53:47.927499 IP ec2-35-172-155-194.compute-1.amazonaws.com.20657 > ip-172-31-95-249.ec2.internal.ssh: Flags [P.], seq 2513:2693, ack 22324, win 4139, options [nop,nop,TS val 4078884995 ecr 48639245], length 180
04:53:47.927758 IP ip-172-31-95-249.ec2.internal.ssh > ec2-35-172-155-194.compute-1.amazonaws.com.20657: Flags [P.], seq 22324:22424, ack 2693, win 2518, options [nop,nop,TS val 48639297 ecr 4078884995], length 100
04:53:47.927976 IP ip-172-31-95-249.ec2.internal.ssh > ec2-35-172-155-194.compute-1.amazonaws.com.20657: Flags [P.], seq 22424:22468, ack 2693, win 2518, options [nop,nop,TS val 48639298 ecr 4078884995], length 44
04:53:47.927991 IP ip-172-31-95-249.ec2.internal.ssh > ec2-35-172-155-194.compute-1.amazonaws.com.20657: Flags [P.], seq 22468:22576, ack 2693, win 2518, options [nop,nop,TS val 48639298 ecr 4078884995], length 108
04:53:47.928640 IP ec2-35-172-155-194.compute-1.amazonaws.com.20657 > ip-172-31-95-249.ec2.internal.ssh: Flags [.], ack 22424, win 4139, options [nop,nop,TS val 4078884996 ecr 48639297], length 0
04:53:47.928820 IP ec2-35-172-155-194.compute-1.amazonaws.com.20657 > ip-172-31-95-249.ec2.internal.ssh: Flags [.], ack 22468, win 4139, options [nop,nop,TS val 4078884996 ecr 48639298], length 0
04:53:47.928840 IP ec2-35-172-155-194.compute-1.amazonaws.com.20657 > ip-172-31-95-249.ec2.internal.ssh: Flags [.], ack 22576, win 4139, options [nop,nop,TS val 4078884996 ecr 48639298], length 0
04:53:48.057960 IP ec2-35-172-155-194.compute-1.amazonaws.com.20657 > ip-172-31-95-249.ec2.internal.ssh: Flags [P.], seq 2693:2889, ack 22576, win 4139, options [nop,nop,TS val 4078885125 ecr 48639298], length 196
04:53:48.058307 IP ip-172-31-95-249.ec2.internal.ssh > ec2-35-172-155-194.compute-1.amazonaws.com.20657: Flags [P.], seq 22576:22692, ack 2889, win 2518, options [nop,nop,TS val 48639428 ecr 4078885125], length 116
04:53:48.059194 IP ec2-35-172-155-194.compute-1.amazonaws.com.20657 > ip-172-31-95-249.ec2.internal.ssh: Flags [.], ack 22692, win 4139, options [nop,nop,TS val 4078885126 ecr 48639428], length 0
04:53:48.059322 IP ip-172-31-95-249.ec2.internal.ssh > ec2-35-172-155-194.compute-1.amazonaws.com.20657: Flags [P.], seq 22692:22808, ack 2889, win 2518, options [nop,nop,TS val 48639429 ecr 4078885126], length 116
04:53:48.060187 IP ec2-35-172-155-194.compute-1.amazonaws.com.20657 > ip-172-31-95-249.ec2.internal.ssh: Flags [.], ack 22808, win 4139, options [nop,nop,TS val 4078885127 ecr 48639429], length 0
04:53:48.144412 IP ec2-35-172-155-194.compute-1.amazonaws.com.20657 > ip-172-31-95-249.ec2.internal.ssh: Flags [P.], seq 2889:3029, ack 22808, win 4139, options [nop,nop,TS val 4078885212 ecr 48639429], length 140
04:53:48.145277 IP ip-172-31-95-249.ec2.internal.ssh > ec2-35-172-155-194.compute-1.amazonaws.com.20657: Flags [P.], seq 22808:22924, ack 3029, win 2518, options [nop,nop,TS val 48639515 ecr 4078885212], length 116
04:53:48.145341 IP ip-172-31-95-249.ec2.internal.ssh > ec2-35-172-155-194.compute-1.amazonaws.com.20657: Flags [P.], seq 22924:22968, ack 3029, win 2518, options [nop,nop,TS val 48639515 ecr 4078885212], length 44
04:53:48.145379 IP ip-172-31-95-249.ec2.internal.ssh > ec2-35-172-155-194.compute-1.amazonaws.com.20657: Flags [P.], seq 22968:23012, ack 3029, win 2518, options [nop,nop,TS val 48639515 ecr 4078885212], length 44
04:53:48.146165 IP ec2-35-172-155-194.compute-1.amazonaws.com.20657 > ip-172-31-95-249.ec2.internal.ssh: Flags [.], ack 22924, win 4139, options [nop,nop,TS val 4078885213 ecr 48639515], length 0
04:53:48.146182 IP ec2-35-172-155-194.compute-1.amazonaws.com.20657 > ip-172-31-95-249.ec2.internal.ssh: Flags [.], ack 22968, win 4139, options [nop,nop,TS val 4078885213 ecr 48639515], length 0
04:53:48.146218 IP ec2-35-172-155-194.compute-1.amazonaws.com.20657 > ip-172-31-95-249.ec2.internal.ssh: Flags [.], ack 23012, win 4139, options [nop,nop,TS val 4078885214 ecr 48639515], length 0
04:53:48.254657 IP ec2-35-172-155-194.compute-1.amazonaws.com.20657 > ip-172-31-95-249.ec2.internal.ssh: Flags [P.], seq 3029:3257, ack 23012, win 4139, options [nop,nop,TS val 4078885322 ecr 48639515], length 228
04:53:48.255196 IP ip-172-31-95-249.ec2.internal.ssh > ec2-35-172-155-194.compute-1.amazonaws.com.20657: Flags [P.], seq 23012:23120, ack 3257, win 2518, options [nop,nop,TS val 48639625 ecr 4078885322], length 108
04:53:48.256084 IP ec2-35-172-155-194.compute-1.amazonaws.com.20657 > ip-172-31-95-249.ec2.internal.ssh: Flags [.], ack 23120, win 4139, options [nop,nop,TS val 4078885323 ecr 48639625], length 0
04:53:48.262197 IP ec2-35-172-155-194.compute-1.amazonaws.com.20657 > ip-172-31-95-249.ec2.internal.ssh: Flags [P.], seq 3257:3413, ack 23120, win 4139, options [nop,nop,TS val 4078885329 ecr 48639625], length 156
04:53:48.262598 IP ip-172-31-95-249.ec2.internal.ssh > ec2-35-172-155-194.compute-1.amazonaws.com.20657: Flags [P.], seq 23120:23492, ack 3413, win 2518, options [nop,nop,TS val 48639632 ecr 4078885329], length 372
04:53:48.305557 IP ec2-35-172-155-194.compute-1.amazonaws.com.20657 > ip-172-31-95-249.ec2.internal.ssh: Flags [.], ack 23492, win 4139, options [nop,nop,TS val 4078885373 ecr 48639632], length 0
04:53:48.325573 IP ec2-35-172-155-194.compute-1.amazonaws.com.20657 > ip-172-31-95-249.ec2.internal.ssh: Flags [P.], seq 3413:3569, ack 23492, win 4139, options [nop,nop,TS val 4078885393 ecr 48639632], length 156
04:53:48.326085 IP ip-172-31-95-249.ec2.internal.ssh > ec2-35-172-155-194.compute-1.amazonaws.com.20657: Flags [P.], seq 23492:23864, ack 3569, win 2518, options [nop,nop,TS val 48639696 ecr 4078885393], length 372
04:53:48.326960 IP ec2-35-172-155-194.compute-1.amazonaws.com.20657 > ip-172-31-95-249.ec2.internal.ssh: Flags [.], ack 23864, win 4139, options [nop,nop,TS val 4078885394 ecr 48639696], length 0
04:53:48.527204 IP ec2-35-172-155-194.compute-1.amazonaws.com.20657 > ip-172-31-95-249.ec2.internal.ssh: Flags [P.], seq 3569:3725, ack 23864, win 4139, options [nop,nop,TS val 4078885594 ecr 48639696], length 156
04:53:48.527761 IP ip-172-31-95-249.ec2.internal.ssh > ec2-35-172-155-194.compute-1.amazonaws.com.20657: Flags [P.], seq 23864:24236, ack 3725, win 2518, options [nop,nop,TS val 48639897 ecr 4078885594], length 372
04:53:48.528666 IP ec2-35-172-155-194.compute-1.amazonaws.com.20657 > ip-172-31-95-249.ec2.internal.ssh: Flags [.], ack 24236, win 4139, options [nop,nop,TS val 4078885596 ecr 48639897], length 0
04:53:48.564187 IP ec2-35-172-155-194.compute-1.amazonaws.com.20657 > ip-172-31-95-249.ec2.internal.ssh: Flags [P.], seq 3725:3881, ack 24236, win 4139, options [nop,nop,TS val 4078885631 ecr 48639897], length 156
04:53:48.564749 IP ip-172-31-95-249.ec2.internal.ssh > ec2-35-172-155-194.compute-1.amazonaws.com.20657: Flags [P.], seq 24236:24608, ack 3881, win 2518, options [nop,nop,TS val 48639934 ecr 4078885631], length 372
04:53:48.609559 IP ec2-35-172-155-194.compute-1.amazonaws.com.20657 > ip-172-31-95-249.ec2.internal.ssh: Flags [.], ack 24608, win 4139, options [nop,nop,TS val 4078885677 ecr 48639934], length 0
04:53:48.650662 IP ec2-35-172-155-194.compute-1.amazonaws.com.20657 > ip-172-31-95-249.ec2.internal.ssh: Flags [P.], seq 3881:4061, ack 24608, win 4139, options [nop,nop,TS val 4078885718 ecr 48639934], length 180
04:53:48.694586 IP ip-172-31-95-249.ec2.internal.ssh > ec2-35-172-155-194.compute-1.amazonaws.com.20657: Flags [.], ack 4061, win 2518, options [nop,nop,TS val 48640064 ecr 4078885718], length 0
04:53:48.803407 IP ec2-35-172-155-194.compute-1.amazonaws.com.20657 > ip-172-31-95-249.ec2.internal.ssh: Flags [P.], seq 4061:4241, ack 24608, win 4139, options [nop,nop,TS val 4078885871 ecr 48640064], length 180
04:53:48.803461 IP ip-172-31-95-249.ec2.internal.ssh > ec2-35-172-155-194.compute-1.amazonaws.com.20657: Flags [.], ack 4241, win 2518, options [nop,nop,TS val 48640173 ecr 4078885871], length 0
04:53:48.803760 IP ip-172-31-95-249.ec2.internal.ssh > ec2-35-172-155-194.compute-1.amazonaws.com.20657: Flags [P.], seq 24608:24708, ack 4241, win 2518, options [nop,nop,TS val 48640173 ecr 4078885871], length 100
04:53:48.804031 IP ip-172-31-95-249.ec2.internal.ssh > ec2-35-172-155-194.compute-1.amazonaws.com.20657: Flags [P.], seq 24708:24824, ack 4241, win 2518, options [nop,nop,TS val 48640174 ecr 4078885871], length 116
04:53:48.804628 IP ec2-35-172-155-194.compute-1.amazonaws.com.20657 > ip-172-31-95-249.ec2.internal.ssh: Flags [.], ack 24708, win 4139, options [nop,nop,TS val 4078885872 ecr 48640173], length 0
04:53:48.804876 IP ec2-35-172-155-194.compute-1.amazonaws.com.20657 > ip-172-31-95-249.ec2.internal.ssh: Flags [.], ack 24824, win 4139, options [nop,nop,TS val 4078885872 ecr 48640174], length 0
04:53:48.805440 IP ip-172-31-95-249.ec2.internal.ssh > ec2-35-172-155-194.compute-1.amazonaws.com.20657: Flags [P.], seq 24824:24980, ack 4241, win 2518, options [nop,nop,TS val 48640175 ecr 4078885872], length 156
04:53:48.806287 IP ec2-35-172-155-194.compute-1.amazonaws.com.20657 > ip-172-31-95-249.ec2.internal.ssh: Flags [.], ack 24980, win 4139, options [nop,nop,TS val 4078885874 ecr 48640175], length 0
04:53:48.809335 IP ip-172-31-95-249.ec2.internal.ssh > ec2-35-172-155-194.compute-1.amazonaws.com.20657: Flags [P.], seq 24980:25024, ack 4241, win 2518, options [nop,nop,TS val 48640179 ecr 4078885874], length 44
04:53:48.809360 IP ip-172-31-95-249.ec2.internal.ssh > ec2-35-172-155-194.compute-1.amazonaws.com.20657: Flags [P.], seq 25024:26068, ack 4241, win 2518, options [nop,nop,TS val 48640179 ecr 4078885874], length 1044
04:53:48.809865 IP ip-172-31-95-249.ec2.internal.ssh > ec2-35-172-155-194.compute-1.amazonaws.com.20657: Flags [P.], seq 26068:26304, ack 4241, win 2518, options [nop,nop,TS val 48640179 ecr 4078885874], length 236
04:53:48.809980 IP ip-172-31-95-249.ec2.internal.ssh > ec2-35-172-155-194.compute-1.amazonaws.com.20657: Flags [P.], seq 26304:26508, ack 4241, win 2518, options [nop,nop,TS val 48640180 ecr 4078885874], length 204
04:53:48.810196 IP ec2-35-172-155-194.compute-1.amazonaws.com.20657 > ip-172-31-95-249.ec2.internal.ssh: Flags [.], ack 25024, win 4139, options [nop,nop,TS val 4078885878 ecr 48640179], length 0
04:53:48.810203 IP ip-172-31-95-249.ec2.internal.ssh > ec2-35-172-155-194.compute-1.amazonaws.com.20657: Flags [P.], seq 26508:26704, ack 4241, win 2518, options [nop,nop,TS val 48640180 ecr 4078885874], length 196
04:53:48.810223 IP ec2-35-172-155-194.compute-1.amazonaws.com.20657 > ip-172-31-95-249.ec2.internal.ssh: Flags [.], ack 26068, win 4131, options [nop,nop,TS val 4078885878 ecr 48640179], length 0
04:53:48.810725 IP ec2-35-172-155-194.compute-1.amazonaws.com.20657 > ip-172-31-95-249.ec2.internal.ssh: Flags [.], ack 26304, win 4130, options [nop,nop,TS val 4078885878 ecr 48640179], length 0
04:53:48.810833 IP ec2-35-172-155-194.compute-1.amazonaws.com.20657 > ip-172-31-95-249.ec2.internal.ssh: Flags [.], ack 26508, win 4129, options [nop,nop,TS val 4078885878 ecr 48640180], length 0
04:53:48.811072 IP ec2-35-172-155-194.compute-1.amazonaws.com.20657 > ip-172-31-95-249.ec2.internal.ssh: Flags [.], ack 26704, win 4128, options [nop,nop,TS val 4078885878 ecr 48640180], length 0
04:53:48.811918 IP ip-172-31-95-249.ec2.internal.ssh > ec2-35-172-155-194.compute-1.amazonaws.com.20657: Flags [P.], seq 26704:26932, ack 4241, win 2518, options [nop,nop,TS val 48640182 ecr 4078885878], length 228
04:53:48.812771 IP ec2-35-172-155-194.compute-1.amazonaws.com.20657 > ip-172-31-95-249.ec2.internal.ssh: Flags [.], ack 26932, win 4127, options [nop,nop,TS val 4078885880 ecr 48640182], length 0
04:53:48.814456 IP ec2-35-172-155-194.compute-1.amazonaws.com.20657 > ip-172-31-95-249.ec2.internal.ssh: Flags [P.], seq 4241:4749, ack 26932, win 4139, options [nop,nop,TS val 4078885882 ecr 48640182], length 508
04:53:48.816039 IP ip-172-31-95-249.ec2.internal.ssh > ec2-35-172-155-194.compute-1.amazonaws.com.20657: Flags [P.], seq 26932:26992, ack 4749, win 2518, options [nop,nop,TS val 48640186 ecr 4078885882], length 60
04:53:48.821319 IP ip-172-31-95-249.ec2.internal.ssh > ec2-35-172-155-194.compute-1.amazonaws.com.20657: Flags [P.], seq 26992:27276, ack 4749, win 2518, options [nop,nop,TS val 48640191 ecr 4078885882], length 284
04:53:48.821474 IP ip-172-31-95-249.ec2.internal.ssh > ec2-35-172-155-194.compute-1.amazonaws.com.20657: Flags [P.], seq 27276:27392, ack 4749, win 2518, options [nop,nop,TS val 48640191 ecr 4078885882], length 116
04:53:48.822216 IP ec2-35-172-155-194.compute-1.amazonaws.com.20657 > ip-172-31-95-249.ec2.internal.ssh: Flags [.], ack 27276, win 4139, options [nop,nop,TS val 4078885889 ecr 48640186], length 0
04:53:48.823955 IP ip-172-31-95-249.ec2.internal.ssh > ec2-35-172-155-194.compute-1.amazonaws.com.20657: Flags [P.], seq 27392:27436, ack 4749, win 2518, options [nop,nop,TS val 48640194 ecr 4078885889], length 44
04:53:48.824013 IP ip-172-31-95-249.ec2.internal.ssh > ec2-35-172-155-194.compute-1.amazonaws.com.20657: Flags [P.], seq 27436:27480, ack 4749, win 2518, options [nop,nop,TS val 48640194 ecr 4078885889], length 44
04:53:48.824828 IP ec2-35-172-155-194.compute-1.amazonaws.com.20657 > ip-172-31-95-249.ec2.internal.ssh: Flags [.], ack 27436, win 4139, options [nop,nop,TS val 4078885892 ecr 48640191], length 0
04:53:48.834498 IP ip-172-31-95-249.ec2.internal.ssh > ec2-35-172-155-194.compute-1.amazonaws.com.20657: Flags [P.], seq 27480:27772, ack 4749, win 2518, options [nop,nop,TS val 48640204 ecr 4078885892], length 292
04:53:48.835177 IP ip-172-31-95-249.ec2.internal.ssh > ec2-35-172-155-194.compute-1.amazonaws.com.20657: Flags [P.], seq 27772:27888, ack 4749, win 2518, options [nop,nop,TS val 48640205 ecr 4078885892], length 116
04:53:48.835385 IP ec2-35-172-155-194.compute-1.amazonaws.com.20657 > ip-172-31-95-249.ec2.internal.ssh: Flags [.], ack 27772, win 4139, options [nop,nop,TS val 4078885903 ecr 48640194], length 0
04:53:48.836777 IP ip-172-31-95-249.ec2.internal.ssh > ec2-35-172-155-194.compute-1.amazonaws.com.20657: Flags [.], seq 27888:33680, ack 4749, win 2518, options [nop,nop,TS val 48640206 ecr 4078885903], length 5792
04:53:48.836788 IP ip-172-31-95-249.ec2.internal.ssh > ec2-35-172-155-194.compute-1.amazonaws.com.20657: Flags [.], seq 33680:39472, ack 4749, win 2518, options [nop,nop,TS val 48640206 ecr 4078885903], length 5792
04:53:48.836844 IP ip-172-31-95-249.ec2.internal.ssh > ec2-35-172-155-194.compute-1.amazonaws.com.20657: Flags [.], seq 39472:42368, ack 4749, win 2518, options [nop,nop,TS val 48640206 ecr 4078885903], length 2896
04:53:48.837774 IP ec2-35-172-155-194.compute-1.amazonaws.com.20657 > ip-172-31-95-249.ec2.internal.ssh: Flags [.], ack 39472, win 4048, options [nop,nop,TS val 4078885905 ecr 48640205], length 0
04:53:48.837786 IP ip-172-31-95-249.ec2.internal.ssh > ec2-35-172-155-194.compute-1.amazonaws.com.20657: Flags [P.], seq 42368:44616, ack 4749, win 2518, options [nop,nop,TS val 48640207 ecr 4078885905], length 2248
04:53:48.837793 IP ec2-35-172-155-194.compute-1.amazonaws.com.20657 > ip-172-31-95-249.ec2.internal.ssh: Flags [.], ack 42368, win 4139, options [nop,nop,TS val 4078885905 ecr 48640206], length 0
04:53:48.838678 IP ec2-35-172-155-194.compute-1.amazonaws.com.20657 > ip-172-31-95-249.ec2.internal.ssh: Flags [.], ack 44616, win 4139, options [nop,nop,TS val 4078885906 ecr 48640207], length 0
04:53:48.838787 IP ec2-35-172-155-194.compute-1.amazonaws.com.20657 > ip-172-31-95-249.ec2.internal.ssh: Flags [P.], seq 4749:4785, ack 44616, win 4139, options [nop,nop,TS val 4078885906 ecr 48640207], length 36
